{
  "runtime_output_version": "0.2.0",
  "mode": "ENGINEERING_TEST",
  "data_source": "SYNTHETIC_FIXTURE",
  "model_status": "TEST_ONLY",
  "prediction_available": true,
  "risk_class": "Caution",
  "risk_class_index": 2,
  "source_window_end_ms": 120000,
  "model_input_channel": "SYNTHETIC_CAPACITIVE",
  "model_artifact_version": "0.1.0",
  "model_artifact_sha256": "aaaaaaaaaaaaaaaaaaaaaaaaaaaaaaaaaaaaaaaaaaaaaaaaaaaaaaaaaaaaaaaa",
  "evidence_scope": "PIPELINE_MECHANICS_ONLY",
  "warning": "ENGINEERING_TEST_ONLY synthetic result; not a patient-risk assessment or clinical output."
}
